{
  "app": "ppl-tracker",
  "version": 4,
  "exportedAt": null,
  "sessions": [],
  "body": [],
  "custom": [],
  "drafts": {},
  "schedules": [
    {
      "id": "starter-ppl",
      "name": "PPL starter",
      "mode": "cycle",
      "days": [
        "pullA",
        "pushA",
        "legsA",
        "pullB",
        "pushB",
        "legsB"
      ],
      "cursor": 0
    }
  ],
  "preferences": {
    "bodyUnit": "kg",
    "selectedWorkoutId": null,
    "progressExercise": null,
    "activeScheduleId": "starter-ppl"
  }
}
